ID,url,Title,Total Comments,Score
164p5gp,https://i.redd.it/mount2x073lb1.jpg,ODA WAS AT THE LA FAN SCREENING,563,19291
166675j,https://i.redd.it/p4kv3783zelb1.png,The One Piece is Real,1114,14545
168a3yn,https://i.redd.it/tmdz4ykmzvlb1.jpg,'ONE PIECE' is currently #1 in 84 countries on NETFLIX.,1463,18605
166n2zs,https://i.redd.it/sr0hb7jnfilb1.png,Is the manga better?,1082,12450
15z47no,https://www.reddit.com/gallery/15z47no,First look at the Live Action Den Den Mushi,931,10352
15xzvdm,https://www.reddit.com/gallery/15xzvdm,How much can i sell this figure?,667,9832
15jzcwz,https://i.redd.it/kcymc0d9sjgb1.jpg,Petition for shocked Kaido to be the new sub image until he is defeated!,240,9805
15kpkl4,https://i.redd.it/12mxpkmqspgb1.gif,"My little brother had a hard time following that scene, so I trimmed it down and thought I'd share it here as well",713,9245
15jdl92,https://www.reddit.com/r/OnePiece/comments/15jdl92/one_piece_episode_1071/,One Piece: Episode 1071,4309,8630
15t1snb,https://www.reddit.com/gallery/15t1snb,My Uber driver is watching one piece,427,8544
163y4k8,https://www.reddit.com/gallery/163y4k8,One Piece Live Action Cast Remakes Manga Cover,370,8431
161h7ow,https://v.redd.it/vl0dj4wfvckb1,This part made me cry,356,8394
1643jyg,https://v.redd.it/69x8wldo4ykb1,This new scene they released for Sanji and the guys at baratie has sold me on the live action ,710,7943
15zw1pw,https://i.redd.it/0pmmlchus0kb1.jpg,What's your fav pannel in OP,1072,7827
167etbj,https://i.redd.it/cqx9k9oqrolb1.png,One Piece is officially the #1 Show on Netflix today,573,7471
15lqulb,https://i.redd.it/pib2wimunxgb1.jpg,This actually feels kinda unreal! It doesn't even feel right for some reason! Only two months? It should have been at least a year.,740,7156
15lpv75,https://i.redd.it/ghz1lyb6hxgb1.png,TBH Luffy is a lot of times goofy,859,7137
15xrzb8,https://www.reddit.com/r/OnePiece/comments/15xrzb8/marco_literally_lost_everythingeverything/,Marco literally lost everything....EVERYTHING.,383,7124
164hi8n,https://v.redd.it/ay6jq807p1lb1,The moment Oda is presented with his very own Transponder Snail and sends out a special message ahead of the One Piece live-action series' worldwide release,233,7066
166myx1,https://i.redd.it/fc7jo0kvfilb1.jpg,Netflix now has One Piece Live Action Profile Pictures,244,7059
15vagwa,https://www.reddit.com/gallery/15vagwa,Words shared between Eiichiro Oda and Netflix during production of the Live Action,753,6853
1674df2,https://i.redd.it/6q9ks0hxomlb1.png,The live action series has a higher audience score on rotten tomatoes than the anime does.,870,6524
1666d9v,https://i.redd.it/0no70xyr0flb1.jpg,Just realized Nami's introduction outfit is based on the old proto concept art.,98,6266
160ju6w,https://i.redd.it/yx6qo19ik5kb1.jpg,Oda has a personal den den mushi,169,6160
15pudl4,https://i.redd.it/1pu283eziuhb1.png,Do you think this was done on purpose?,290,6148
15nhb2a,https://v.redd.it/md3xuatn6bhb1,"One Paced the ep 1071! Fixed pacing, audio, visibility, etc.",444,6149
160rxia,https://v.redd.it/2f7iqaywh7kb1,Straw Hats Set Sail After 20 Years! (Animation),335,6141
165fc6e,https://www.reddit.com/gallery/165fc6e,The 'turn the characters into real people' squad,222,6095
167gvng,https://www.reddit.com/gallery/167gvng,"Now that a second season of one piece seems relatively realistic, what do you think/hope or fear what chopper will look like?",1243,6139
165w0ka,https://i.redd.it/r31yz2c1eclb1.jpg,Netflix billboard!!,75,6058
15oloxw,https://i.redd.it/g1lizi00xjhb1.jpg,Everyone talks about the Arlong Park walk…,230,6062
167xr9u,https://i.redd.it/7souqlge7tlb1.jpg,Official account of Microsoft 365 replies to Netflix tweet,293,6315
166wrtg,https://www.reddit.com/r/OnePiece/comments/166wrtg/idk_if_this_community_approve_of_the_life_action/,Idk if this community approve of the life action “One Piece” on Netflix but…,371,5708
165e6fw,https://www.youtube.com/watch?v=l6kp780S-os,ONE PIECE | Final Trailer | Netflix,1033,5687
15hx42q,https://www.reddit.com/gallery/15hx42q,"Some of Takashi Kojima’s One Piece illustrations, for those that have never seen them",110,5670
15x6at4,https://i.redd.it/n5ao4li0jgjb1.jpg,My son dressed up as Crocodile for Comic Con.,99,5618
15s86yp,https://v.redd.it/pn7dzacfvcib1,chapter 1087 1088 walmart animation,219,5527
15la4e5,https://v.redd.it/7gnfb0q02ugb1,"Poor Gorosei, having to go meet the population...",150,5477
15yt1es,https://v.redd.it/x8ecltiqdsjb1,okama way!,89,5399
164r3p6,https://i.redd.it/8i7aocldk3lb1.png,New Image of Jeff Ward as Buggy.,185,5327
15nro9w,https://i.redd.it/q3rov2ez7dhb1.jpg,Does everyone who enter Grand Line meet Laboon?,314,5327
15lhuub,https://i.redd.it/ortfowsyyvgb1.jpg,Same thing will happen when One piece ends.,691,5309
162r9mg,https://i.redd.it/sb5491vjtnkb1.jpg,What was the moment you realized Luffy’s rubber powers weren’t normal?,1371,5137
15mtetf,https://www.reddit.com/r/OnePiece/comments/15mtetf/one_piece_chapter_1090_spoilers/,One Piece Chapter 1090 spoilers,5095,5105
15lza6x,https://i.redd.it/gx62tgpi9zgb1.jpg,Why did people think it was ever a good idea to skip?,605,5080
166csdd,https://i.redd.it/m1dcueh7iglb1.jpg,Seeing live action OP at the age of 38. How old are you guys?,1729,5071
15r2gea,https://i.redd.it/az990g3xa4ib1.jpg,Does Kaido have Gears like Luffy?,636,5054
165nan0,https://i.redd.it/lqq2p7eznalb1.jpg,Underrated Luffy Moment,111,4972
15klm1y,https://i.redd.it/06iytidx2pgb1.png,Is there a chance? Why?,1437,4808
15wg340,https://i.redd.it/oddr8gmlmajb1.jpg,What this really means,380,4803
163dljc,https://www.reddit.com/r/OnePiece/comments/163dljc/one_piece_chapter_1091_spoilers/,One Piece Chapter 1091 Spoilers,6054,4586
15lyq7a,https://i.redd.it/tn77mpn55zgb1.jpg,Who would of thought,254,4456
15lky47,https://i.redd.it/pc5avbpyjwgb1.png,Inherited Will (oc),155,4373
15w4sh4,https://www.reddit.com/gallery/15w4sh4,Who wins in an all out battle.,1162,4341
15u3nbg,https://i.redd.it/qbklc1ojarib1.jpg,Why do people say that luffy would have awakened whenever he died?,460,4323
15u4cjm,https://i.redd.it/zgt6u1drfrib1.jpg,New image of Craig Fairbrass as Zeff in the OPLA,227,4319
15mi620,https://i.redd.it/ewukjh0xp3hb1.jpg,luffy has come such a long way,124,4227
15lmffy,https://www.reddit.com/gallery/15lmffy,Emily Rudd is going to wear Nami's beta outfit.,254,4189
167x3wi,https://i.redd.it/8cxcbfsa0tlb1.jpg,Would you take it as confirmation?,758,4714
15nivq0,https://www.reddit.com/gallery/15nivq0,How some fans read Gear 5th,1083,3960
15obnka,https://i.redd.it/0mhfgvdrzhhb1.jpg,My Vivi cosplay :3,123,3945
1608vbd,https://v.redd.it/odpddoh5i3kb1,"Miltiadis D Tentoglou did Luffy's ""Gear 5"" pose in the Men's Long Jump at the World Championship 2023 in Bucharest",123,3927
166u6ba,https://www.reddit.com/gallery/166u6ba,One Piece Netflix Logo Designs each episode,125,3922
15q3xai,https://www.reddit.com/gallery/15q3xai,An attempt was made for this Nami fit :3,211,3881
161k0ra,https://i.redd.it/wgimk4gzjdkb1.jpg,Oda still has a photo of Che Guevara in his office,1245,3800
15qbo34,https://www.reddit.com/gallery/15qbo34,Blackbeard Pirates match up based on their potential vice and virtues,328,3757
165dnua,https://www.reddit.com/r/OnePiece/comments/165dnua/one_piece_chapter_1091/,One Piece: Chapter 1091,3826,3693
15ws1ov,https://i.redd.it/0ozdirwhzcjb1.jpg,What are you most worried won't match your expectations?,786,3664
15laykk,https://i.redd.it/hitqvhp4augb1.jpg,This is the episode we should be hyped about!!!,435,3653
15oyiw9,https://i.redd.it/iff8rnjfymhb1.jpg,If ace being Roger's son wasn't planned from the beginning who could have been ace's dad originally? Dragon?,539,3646
15i3dp8,https://www.reddit.com/gallery/15i3dp8,"My 3 year timeskip of painting BORN TO BOIL, before and after!",83,3634
1612vih,https://www.reddit.com/gallery/1612vih,I received this box in the mail with a Strawhat from Netflix! What is this from and what did I win?!,263,3622
15y4g4t,https://i.redd.it/spup49iaonjb1.jpg,If this early screening review is anything to go by I think it’s safe to say… we won,884,3577
166moun,https://i.redd.it/kiwd20f1eilb1.jpg,One Piece Live Action is now certified fresh on Rotten Tomatoes,428,3572
1684110,https://i.redd.it/lcawa42xrulb1.png,"Based on Season 1, how I think subsequent seasons might be split.",986,4064
15xez11,https://i.redd.it/8gww5rb26ijb1.jpg,Cosplaying Robin with my natural hair!,164,3498
166ndl7,https://i.redd.it/6fjvxw8hiilb1.jpg,I binge watched the entire season today and oh boy it was soo good!,402,3488
161yxod,https://www.reddit.com/gallery/161yxod,"I made a kuma figure with wood, how is this?",182,3480
15q1e1k,https://i.redd.it/5jy79lww8whb1.jpg,Luffy's Gears,104,3439
15yl0tx,https://www.reddit.com/gallery/15yl0tx,new group pictures of the live action cast!,331,3404
1608zcv,https://i.redd.it/w72mnmzzi3kb1.jpg,Iñaki Godoy visiting Oda's studio and meeting him! Apparently there's gonna be a video soon about it.,168,3364
15lyitk,https://i.redd.it/2jijj30t3zgb1.jpg,He's gone to far this time!,186,3297
165c6dw,https://v.redd.it/x0u8v9yhh8lb1,Which scene in One Piece gave you goosebumps?,247,3245
1653ma0,https://v.redd.it/wjhhi8tc36lb1,Straw Hats arrive at Baratie |OPLA New Clip,362,3246
15ieez7,https://www.reddit.com/r/OnePiece/comments/15ieez7/people_who_tell_newbies_to_skip_the_skypiea_arc/,"People who tell newbies to skip the Skypiea arc, what's wrong with you?",729,3137
15tmxxw,https://www.reddit.com/gallery/15tmxxw,New Character Posters for the Live Action Series,580,3138
15rqh7d,https://www.reddit.com/r/OnePiece/comments/15rqh7d/admiral_kizarus_unclear_justice_the_man_with_no/,Admiral Kizaru's Unclear Justice - The man with no dreams (Chapter 1090 Spoilers),357,3123
163lpze,https://i.redd.it/jg822eexoukb1.png,Hawkings might hinted Luffy can't fully die.,200,3062
15yw0hr,https://i.redd.it/pmkslux66tjb1.jpg,The easiest way to create a black blade,127,3055
15vteel,https://i.redd.it/1rahhz4724jb1.png,Official Art that Oda drew that not many know about,108,3045
15kebws,https://i.redd.it/68cpswmscngb1.png,My reaction after watching Gear 5 (OC),61,3042
167dj2t,https://i.redd.it/nz31ifa4jolb1.png,This is what Oda wanted more then anything else. The United States has always been the one place where One Piece was not big. Now it's number one!,165,3038
15rl745,https://v.redd.it/z68c9wp448ib1,The 4th road poneglyph is not required. (This took me so long to make sorry for bad quality I'm not good at animating.),702,3022
16827vp,https://i.redd.it/i9w56wgtdulb1.jpg,One of Onteresting Original Item from the Live Action,104,3566
166zid4,https://i.redd.it/5dq0lrqballb1.png,Live action character tier list by how much I liked their performances.,757,2979
165fwaz,https://i.redd.it/iarhdydx99lb1.jpg,Shanks age?,112,2949
15j7jhx,https://i.redd.it/533wrwak2dgb1.png,Your opinion on post time skip Franky's design ?,753,2936
1670m8v,https://www.reddit.com/r/OnePiece/comments/1670m8v/my_wife_asked_why_i_got_tearyeyed_when_shanks_was/,My wife asked why I got teary-eyed when Shanks was talking to Luffy,209,2930
15x377o,https://www.reddit.com/gallery/15x377o,Found in Denmark,59,2910
15jvjc0,https://i.redd.it/5vpyl9iw0jgb1.jpg,A friend of mine is claiming that this moment of Luffy is copied from Eren.,540,2910
